{
  "$schema": "https://json-schema.org/draft/2020-12/schema",
  "$id": "https://moyva.local/schemas/tile-world-creator-id-mapping.schema.json",
  "title": "Moyva — Tile World Creator Id Mapping SO",
  "description": "JSON source of truth для Kruty1918.Moyva.Generator.API.TileWorldCreatorIdMappingSO. Згенеровано з фактичного Unity serialization contract; runtime читає JSON напряму.",
  "type": "object",
  "additionalProperties": false,
  "required": [
    "schema",
    "version",
    "id",
    "model"
  ],
  "properties": {
    "$schema": {
      "type": "string",
      "title": "JSON Schema"
    },
    "schema": {
      "const": "moyva.tile-world-creator-id-mapping"
    },
    "version": {
      "type": "integer",
      "minimum": 1,
      "default": 1
    },
    "id": {
      "type": "string",
      "minLength": 1,
      "pattern": "^[a-z0-9]+(?:-[a-z0-9]+)*$",
      "title": "Стабільний ID",
      "description": "Стабільний ідентифікатор. Використовуйте дефіси; ID не залежить від filename або C# class name."
    },
    "model": {
      "const": "tile-world-creator-id-mapping"
    },
    "migration": {
      "type": "object",
      "additionalProperties": true
    },
    "terrainLayers": {
      "type": [
        "array",
        "null"
      ],
      "items": {
        "type": [
          "object",
          "null"
        ],
        "properties": {
          "idPattern": {
            "type": [
              "string",
              "null"
            ],
            "title": "Id Pattern"
          },
          "blueprintLayerGuid": {
            "type": [
              "string",
              "null"
            ],
            "title": "Blueprint Layer Guid"
          },
          "blueprintLayerName": {
            "type": [
              "string",
              "null"
            ],
            "title": "Blueprint Layer Name"
          },
          "tilePreset": {
            "type": [
              "object",
              "null"
            ],
            "description": "Opaque Unity asset reference. Gameplay values не зберігаються в Unity asset.",
            "properties": {
              "$asset": {
                "type": "string",
                "title": "Asset ID"
              },
              "editorPath": {
                "type": "string",
                "description": "Editor-only path для діагностики/регенерації catalog."
              },
              "required": {
                "type": "boolean",
                "default": true
              }
            },
            "required": [
              "$asset"
            ],
            "title": "Tile Preset"
          },
          "useDualGrid": {
            "type": "boolean",
            "title": "Use Dual Grid"
          },
          "scaleTileToCellSize": {
            "type": "boolean",
            "title": "Scale Tile To Cell Size"
          },
          "registryVisualPrefab": {
            "type": [
              "object",
              "null"
            ],
            "description": "Opaque Unity asset reference. Gameplay values не зберігаються в Unity asset.",
            "properties": {
              "$asset": {
                "type": "string",
                "title": "Asset ID"
              },
              "editorPath": {
                "type": "string",
                "description": "Editor-only path для діагностики/регенерації catalog."
              },
              "required": {
                "type": "boolean",
                "default": true
              }
            },
            "required": [
              "$asset"
            ],
            "title": "Registry Visual Prefab"
          },
          "movementCost": {
            "type": "number",
            "title": "Movement Cost"
          }
        },
        "additionalProperties": false
      },
      "title": "Terrain Layers"
    },
    "objectLayers": {
      "type": [
        "array",
        "null"
      ],
      "items": {
        "type": [
          "object",
          "null"
        ],
        "properties": {
          "idPattern": {
            "type": [
              "string",
              "null"
            ],
            "title": "Id Pattern"
          },
          "blueprintLayerGuid": {
            "type": [
              "string",
              "null"
            ],
            "title": "Blueprint Layer Guid"
          },
          "blueprintLayerName": {
            "type": [
              "string",
              "null"
            ],
            "title": "Blueprint Layer Name"
          },
          "tilePreset": {
            "type": [
              "object",
              "null"
            ],
            "description": "Opaque Unity asset reference. Gameplay values не зберігаються в Unity asset.",
            "properties": {
              "$asset": {
                "type": "string",
                "title": "Asset ID"
              },
              "editorPath": {
                "type": "string",
                "description": "Editor-only path для діагностики/регенерації catalog."
              },
              "required": {
                "type": "boolean",
                "default": true
              }
            },
            "required": [
              "$asset"
            ],
            "title": "Tile Preset"
          },
          "useDualGrid": {
            "type": "boolean",
            "title": "Use Dual Grid"
          },
          "scaleTileToCellSize": {
            "type": "boolean",
            "title": "Scale Tile To Cell Size"
          },
          "registryVisualPrefab": {
            "type": [
              "object",
              "null"
            ],
            "description": "Opaque Unity asset reference. Gameplay values не зберігаються в Unity asset.",
            "properties": {
              "$asset": {
                "type": "string",
                "title": "Asset ID"
              },
              "editorPath": {
                "type": "string",
                "description": "Editor-only path для діагностики/регенерації catalog."
              },
              "required": {
                "type": "boolean",
                "default": true
              }
            },
            "required": [
              "$asset"
            ],
            "title": "Registry Visual Prefab"
          },
          "movementCost": {
            "type": "number",
            "title": "Movement Cost"
          }
        },
        "additionalProperties": false
      },
      "title": "Object Layers"
    },
    "buildingLayers": {
      "type": [
        "array",
        "null"
      ],
      "items": {
        "type": [
          "object",
          "null"
        ],
        "properties": {
          "idPattern": {
            "type": [
              "string",
              "null"
            ],
            "title": "Id Pattern"
          },
          "blueprintLayerGuid": {
            "type": [
              "string",
              "null"
            ],
            "title": "Blueprint Layer Guid"
          },
          "blueprintLayerName": {
            "type": [
              "string",
              "null"
            ],
            "title": "Blueprint Layer Name"
          },
          "tilePreset": {
            "type": [
              "object",
              "null"
            ],
            "description": "Opaque Unity asset reference. Gameplay values не зберігаються в Unity asset.",
            "properties": {
              "$asset": {
                "type": "string",
                "title": "Asset ID"
              },
              "editorPath": {
                "type": "string",
                "description": "Editor-only path для діагностики/регенерації catalog."
              },
              "required": {
                "type": "boolean",
                "default": true
              }
            },
            "required": [
              "$asset"
            ],
            "title": "Tile Preset"
          },
          "useDualGrid": {
            "type": "boolean",
            "title": "Use Dual Grid"
          },
          "scaleTileToCellSize": {
            "type": "boolean",
            "title": "Scale Tile To Cell Size"
          },
          "registryVisualPrefab": {
            "type": [
              "object",
              "null"
            ],
            "description": "Opaque Unity asset reference. Gameplay values не зберігаються в Unity asset.",
            "properties": {
              "$asset": {
                "type": "string",
                "title": "Asset ID"
              },
              "editorPath": {
                "type": "string",
                "description": "Editor-only path для діагностики/регенерації catalog."
              },
              "required": {
                "type": "boolean",
                "default": true
              }
            },
            "required": [
              "$asset"
            ],
            "title": "Registry Visual Prefab"
          },
          "movementCost": {
            "type": "number",
            "title": "Movement Cost"
          }
        },
        "additionalProperties": false
      },
      "title": "Building Layers"
    }
  }
}
